proof_id,claim,proof,asset,use_in_pitch
IP-001,"Arsenal is a platform, not a single-purpose AI wrapper.","91 routes, 57 edge functions, 115 discovered table/storage names, 28 feature clusters.","Platform Command Map, platform overview, feature inventory.",Open with scope compression and platform breadth.
IP-002,"Revenue primitives already exist across subscription, credits, marketplace, partner, and service lines.","Subscriptions, credit top-ups, paid Arsenals, Stripe Connect, referral commissions, Business Space gates.","Revenue Opportunity Matrix, monetization-surfaces.csv, offer catalog.","Show multiple monetization paths, then focus go-to-market on the top two."
IP-003,Arsenal has a defensible AI control plane.,"ai-route covers provider keys, model routes, limits, credits, events, and fallbacks.","AI Feature Control Plane, AI routing map, risk register.",Frame governance and margin as infrastructure value.
IP-004,Business Spaces can become the flagship B2B revenue wedge.,"Plan, ROI, proposal, command center, Night Shift, Flex OS, portal, export.","Business Spaces Revenue Engine, offer stack board.",Explain how a lead becomes a recurring workspace.
IP-005,The platform can turn output into compounding proof.,"Vault, workspace files, replays, proposals, reports, portal exports.","Proof Vault map, proof-to-pitch pipeline.",Show why customer outcomes become marketing assets.
