moat_id,moat,evidence,why_hard_to_copy,current_strength,reinforcement_action
MOAT-001,Route-to-revenue spine,"ai-route, credit ledger, tier gates, route events, model routing, top-ups","It requires product, billing, provider routing, admin policy, and feature-level integration to all work together.",High,Migrate or document remaining direct AI paths and publish the AI routing audit offer.
MOAT-002,Proof accumulation layer,"Files, Vault, workspace versions, replays, proposals, reports, portal export","Competitors can generate output, but persistent proof tied to work history and client delivery is harder to fake.",High,Make proof lineage visible in demos and package a client portal offer.
MOAT-003,Business Space schema,"Business profiles, ROI, proposal, agents, automations, Night Shift, portal",The system models the business as an operating environment rather than a chat session.,High,Ship a canonical demo Business Space and sell setup packages.
MOAT-004,Admin governance depth,"Users, roles, flags, providers, limits, credits, audit, operators, partners, pages",Governance usually appears late. Arsenal already has a broad control plane spanning revenue and AI operations.,Medium-high,Harden admin/RLS/audit checklist before enterprise positioning.
MOAT-005,Creator commerce surface area,"Arsenals, prompt packs, marketplace, Discover, paid access, Connect, commissions","The bundle can include agents, prompts, pages, workflows, experiences, and credentials, not one narrow artifact.",Medium,Launch one paid listing pattern with payout visibility.
MOAT-006,Distribution loops,"Public agents, embeds, channels, partners, referrals, public pages, programs, Zen Daily",Multiple outward-facing surfaces can turn product use into acquisition and proof.,Medium-high,Pick two loops for immediate launch: partner referrals and Smart Solution lead magnet.
MOAT-007,Operator automation framing,"Night Shift, Flex OS, schedules, flows, replays, approvals","It reframes automation as accountable labor with roles, states, and proof instead of invisible execution.",Medium,"Validate credit lifecycle, then market Night Shift as a paid add-on."
MOAT-008,Atlas as strategic asset,"Feature map, route map, revenue map, risk register, visuals, strategic leverage layer","The map compresses a large platform into investor, marketing, and engineering intelligence.",High,"Turn Atlas visuals into landing-page, pitch-deck, and internal roadmap assets."
